"purchase_id","contract_id","buyer_id","purchase_cost_uah","volume_uah","contract_date","region_id","volume","winner.bid","loser_bid","winner","buyer_name"
390249,461491,68927,3e+05,258850,"2013-02-12",13,258850,258963.4,261438.65,TRUE,"Ульяновська центральна районна лікарня Кіровоградської області"
401463,463379,9437,5e+05,432700,"2013-02-15",13,432700,432700,440900,TRUE,"Гайворонське районне територіальне медичне об’єднання"
398001,460154,3155,486600,494250,"2013-02-11",13,494250,494250,501500,TRUE,"Долинська центральна районна лікарня Кіровоградської області"
403859,455404,67824,199000,193563,"2013-02-01",13,193563,193563,197181,TRUE,"Центральна районна лікарня Олександрівського району"
469951,554391,68927,140000,154950,"2014-01-28",13,154950,155061.5,159387.25,TRUE,"Ульяновська центральна районна лікарня Кіровоградської області"
479401,568647,3155,236520,229205,"2014-02-24",13,229205,458502,475132,TRUE,"Долинська центральна районна лікарня Кіровоградської області"
