"purchase_id","contract_id","buyer_id","purchase_cost_uah","volume_uah","contract_date","region_id","volume","winner.bid","loser_bid","winner","buyer_name"
421697,488452,16203,165000,165000,"2013-04-02",12,165000,165000,186000,TRUE,"Бородянська селищна рада Київської області"
433640,494005,621,240000,227800,"2013-04-23",19,227800,227800,228000,TRUE,"Комунальне Рівненське шляхово-експлуатаційне управління автомобільних доріг"
451582,517058,126103,190000,162000,"2013-08-20",14,162000,162000,176000,TRUE,"Олександрівська сільрада міста Свердловська Луганської області"
459843,528396,185609,160000,156000,"2013-11-01",20,156000,156000,172000,TRUE,"Сумське обласне управління лісового та мисливського господарства Держагентства лісових ресурсів України"
466871,540223,75285,183000,180000,"2013-12-27",1,180000,210000,214666.67,TRUE,"Комунальне підприємство Іванківської райради ""Виробниче управління житлово-комунального господарства"" Київської області"
472098,540741,54543,172000,148800,"2013-12-30",16,148800,148882.1,149582.1,TRUE,"ЖОВТНЕВЕ УПРАВЛІННЯ ВОДНОГО ГОСПОДАРСТВА Держагентства водних ресурсів України"
