"purchase_id","contract_id","buyer_id","purchase_cost_uah","volume_uah","contract_date","region_id","volume","winner.bid","loser_bid","winner","buyer_name"
229738,246336,7087,NA,20472,"2011-11-11",21,20472,20472,20565,TRUE,"Тернопільський обласний центр зайнятості Державного центру зайнятості Мінпраці та соцполітики України"
445414,503854,116,99993.3,99155.9,"2013-06-05",21,99155.9,99373.8,100842.3,TRUE,"ТЕРНОПІЛЬСЬКА ОБЛАСНА КОМУНАЛЬНА КЛІНІЧНА ПСИХОНЕВРОЛОГІЧНА ЛІКАРНЯ"
450846,513318,5753,103000,98150,"2013-07-18",21,98150,98150,98965,TRUE,"Збаразька центральна районна комунальна лікарня Тернопільської області"
455204,526077,228956,5e+05,490071,"2013-10-18",21,490071,490071,494824,TRUE,"Державна установа ""Тернопільський обласний лабораторний центр Держсанепідслужби України"""
522231,597426,124819,181000,176472,"2014-05-26",21,176472,176472,179955,TRUE,"Відділ освіти Бережанської райдержадміністрації Тернопільської області"
523478,606787,55333,305800,299880,"2014-07-22",21,299880,299880,302090,TRUE,"Відділ освіти Гусятинської райдержадміністрації Тернопільської області"
