"purchase_id","contract_id","buyer_id","purchase_cost_uah","volume_uah","contract_date","region_id","volume","winner.bid","loser_bid","winner","buyer_name"
479816,570957,74055,720020,647780,"2014-02-28",22,647780,648373.5,673406.75,TRUE,"КП ""Комунальник"" Зміївського району Харківської області"
481220,572422,4429,299400,299640,"2014-03-03",22,299640,299827.7,311708.4,TRUE,"КЗОЗ ""Зміївська центральна районна лікарня"""
502275,588248,9434,4e+05,437550,"2014-04-11",22,437550,437550,446275,TRUE,"Лиманське державне виробниче сільськогосподарсько-рибоводне підприємство"
514191,596260,73659,327439,443022,"2014-05-13",22,443022,616074,629504.4,TRUE,"Відділ освіти Валківської районної державної адміністрації"
515694,595590,257851,338400,338360,"2014-05-15",22,338360,338632.03,411477.2,TRUE,"Комунальний заклад охорони здоров’я ""Зміївський районний центр первинної медико-санітарної допомоги"" Зміївської районної ради Харківської області"
