"purchase_id","contract_id","buyer_id","purchase_cost_uah","volume_uah","contract_date","region_id","volume","winner.bid","loser_bid","winner","buyer_name"
491799,561293,4507,189900,138416,"2014-02-10",24,138416,138416,141370,TRUE,"Городоцька міська рада Хмельницької області"
494913,568847,6534,187200,171600,"2014-02-24",24,171600,171600,180960,TRUE,"Відділ освіти, молоді та спорту Славутської райдержадміністрації Хмельницької області"
502067,587531,6534,435000,420500,"2014-04-07",24,420500,420500,427750,TRUE,"Відділ освіти, молоді та спорту Славутської райдержадміністрації Хмельницької області"
502074,587534,6534,350000,334000,"2014-04-07",24,334000,334000,343000,TRUE,"Відділ освіти, молоді та спорту Славутської райдержадміністрації Хмельницької області"
510135,586046,3333,226188,224296,"2014-04-02",24,224296,224296,225376,TRUE,"Дунаєвецька міськрада Хмельницької області"
