"purchase_id","contract_id","buyer_id","purchase_cost_uah","volume_uah","contract_date","region_id","volume","winner.bid","loser_bid","winner","buyer_name"
377986,420899,5430,9e+05,931425,"2012-11-23",11,931425,931425,951075,TRUE,"УПРАВЛІННЯ Державтоінспекції  УМВС України В ІВАНО-ФРАНКІВСЬКІЙ ОБЛАСТІ "
388298,441189,3999,513280,531313,"2013-01-11",24,531313,531313,537391,TRUE,"Відділ освіти, молоді та спорту Летичівської райдержадміністрації Хмельницької області"
410606,460046,3762,198000,220082,"2013-02-11",11,220082,220082,223314.9,TRUE,"Відділ освіти Городенківської райдержадміністрації Івано-Франківської області"
401657,465501,72872,737097,706255.9,"2013-02-19",11,706255.9,706255.9,711050.53,TRUE,"Тлумацька центральна районна лікарня Івано-Франківської області"
405652,474963,1633,216000,215839.04,"2013-03-04",4,215839.04,215839.04,229694.79,TRUE,"Відділ освіти Бершадської райдержадміністрації Вінницької області"
405258,468958,7371,2871795,3091132.5,"2013-02-22",11,3091132.5,3091132.5,3117840.75,TRUE,"Коломийська центральна районна лікарня Івано-Франківської області"
402420,463131,9795,401704,385592.13,"2013-02-15",4,385592.13,385802.4,398221.95,TRUE,"Відділ освіти Оратівської райдержадміністрації Вінницької області"
412997,475566,64566,674931,754590,"2013-03-05",11,754590,754919.7,763416.04,TRUE,"Галицьке міжрайонне управління водного господарства Івано-Франківської області"
411896,475318,67160,535050,535050,"2013-03-06",11,535050,535050,537710,TRUE,"Комунальний заклад ""Галицька центральна районна лікарня"""
413260,478185,6231,217206,215580,"2013-03-12",11,215580,215699.1,218978.44,TRUE,"Відділ освіти Калуської райдержадміністрації Івано-Франківської області"
406841,472239,78158,277636,285835,"2013-03-01",15,285835,285835,287050.5,TRUE,"Ходорівська районна лікарня Жидачівського району Львівської області"
416158,480943,18009,480269,491746.4,"2013-03-18",15,491746.4,491746.4,497379.2,TRUE,"Відділ освіти Жидачівської райдержадміністрації Львівської області"
416164,480397,4479,1247360,1236930,"2013-03-15",11,1236930,1236930,1246276,TRUE,"Центральна районна лікарня Надвірнянського району Івано-Франківської області"
408740,484446,31162,5e+05,545300,"2013-03-26",11,545300,545300,548380,TRUE,"Городенківська центральна районна лікарня Івано-Франківської області"
427576,485903,3405,435137,468614.82,"2013-03-29",11,468614.82,468614.82,514627.32,TRUE,"Відділ освіти Косівської райдержадміністрації Івано-Франківської області"
406961,468796,5364,1080300,1035005,"2013-02-22",11,1035005,1035311.7499,1040571.0862,TRUE,"Комунальна організація (Установа, Заклад) ""Станція швидкої та невідкладної медичної допомоги"" Калуської міської ради Івано-Франківської області"
429044,482035,99231,180000,185440,"2013-03-19",4,185440,185440,204800,TRUE,"Оратівський районний Центр первинної медико-санітарної допомоги Вінницької області"
406768,472106,59136,197396.27,214808.6,"2013-03-01",15,214808.6,214808.6,215956.8,TRUE,"Жидачівська центральна районна лікарня Львівської області"
431033,490408,16016,3e+05,336048,"2013-04-12",11,336048,336048,338719.4,TRUE,"Обласна клінічна лікарня Департаменту охорони здоров’я Івано-Франківської облдержадміністрації"
414900,485676,1970,388845,393600,"2013-03-29",15,393600,393803.4,397943.8,TRUE,"Відділ освіти Турківської районної державної адміністрації"
441648,497673,113365,112000,121760,"2013-05-08",15,121760,121760,122720,TRUE,"Стрийський міський комбінат комунальних підприємств Львівської області"
427118,488943,7799,376550.7,385985.6,"2013-04-08",11,385985.6,385985.6,403594.1,TRUE,"Косівська центральна районна лікарня Івано-Франківської області"
426126,487783,225507,320000,323515,"2013-04-02",15,323515,323811.5,324389.3,TRUE,"Комунальний заклад Львівської обласної ради ""Дрогобицька міська станція швидкої медичної допомоги"""
435117,488833,97931,158311.2,166313.5,"2013-04-08",11,166313.5,89832627,89848729.6,TRUE,"Кутська міська лікарня Івано-Франківської області"
437981,498894,85334,293003.7,363920,"2013-05-13",11,363920,363920,370909.5,TRUE,"Яблунівська районна лікарня Івано-Франківської області"
446986,509592,1712,3045000,2901000,"2013-07-02",15,2901000,2901000,2910000,TRUE,"ВП ""Служба матеріально-технічного постачання""  ДТГО ""Львівська залізниця"""
466339,531769,95394,35000,38296,"2013-11-22",15,38296,38296,38460,TRUE,"Підкамінський психоневрологічний інтернат Львівської області"
465941,540623,239,2e+05,198627.4,"2013-12-27",17,198627.4,198627.4,200842,TRUE,"ВП ""Південна електроенергетична система"" ДП ""НЕК ""Укренерго"""
480497,557758,113365,105000,118650,"2014-02-04",15,118650,118650,120540,TRUE,"Стрийський міський комбінат комунальних підприємств Львівської області"
488011,577400,1633,263162,226942.29,"2014-03-11",4,226942.29,226942.29,237237.99,TRUE,"Відділ освіти Бершадської райдержадміністрації Вінницької області"
484912,558087,95394,190000,99330,"2014-02-04",15,99330,99330,99950,TRUE,"Підкамінський психоневрологічний інтернат Львівської області"
493733,569681,212221,150000,156931,"2014-02-21",4,156931,156931,159016,TRUE,"КЗ ""Чечельницький районний центр первинної медико-санітарної допомоги"" Управління охорони здоров’я Вінницької облдержадміністрації "
479458,581760,18009,368880,373318,"2014-03-20",15,373318,373318,376392,TRUE,"Відділ освіти Жидачівської райдержадміністрації Львівської області"
485707,571809,9795,528828,472124.61,"2014-02-28",4,472124.61,472344.58,494380.58,TRUE,"Відділ освіти Оратівської райдержадміністрації Вінницької області"
504847,580145,136978,108500,153910,"2014-03-18",15,153910,153910,155940,TRUE,"Великомостівський геріатричний пансіонат Сокальського району Львівської області"
511666,587416,99231,148912,162911,"2014-04-08",4,162911,162911,165410,TRUE,"Оратівський районний Центр первинної медико-санітарної допомоги Вінницької області"
497439,586140,239,416600,414874.8,"2014-04-03",17,414874.8,414874.8,516673.3,TRUE,"ВП ""Південна електроенергетична система"" ДП ""НЕК ""Укренерго"""
498443,582478,97864,310300,384020,"2014-03-25",15,384020,384250.9,387111.3,TRUE,"Сокальське управління водного господарства"
496884,581204,78158,205033,280930,"2014-03-21",15,280930,280930,282830,TRUE,"Ходорівська районна лікарня Жидачівського району Львівської області"
503224,578860,59136,143015,199915,"2014-03-17",15,199915,199915,199960.6,TRUE,"Жидачівська центральна районна лікарня Львівської області"
